<?xml version="1.0" encoding="UTF-8"?>
<!DOCTYPE Schlangenjagd SYSTEM "schlangenjagd.dtd">
<Schlangenjagd>
    <Zeit einheit="s">
        <Vorgabe>10.0</Vorgabe>
    </Zeit>
    <Dschungel zeilen="5" spalten="5" zeichen="VIP">
        <Feld id="F0" zeile="0" spalte="0" verwendbarkeit="5" punkte="5">V</Feld>
        <Feld id="F1" zeile="0" spalte="1" verwendbarkeit="8" punkte="8">T</Feld>
        <Feld id="F2" zeile="0" spalte="2" verwendbarkeit="7" punkte="7">P</Feld>
        <Feld id="F3" zeile="0" spalte="3" verwendbarkeit="3" punkte="3">E</Feld>
        <Feld id="F4" zeile="0" spalte="4" verwendbarkeit="4" punkte="4">V</Feld>
        <Feld id="F5" zeile="1" spalte="0" verwendbarkeit="4" punkte="4">T</Feld>
        <Feld id="F6" zeile="1" spalte="1" verwendbarkeit="4" punkte="4">I</Feld>
        <Feld id="F7" zeile="1" spalte="2" verwendbarkeit="6" punkte="6">E</Feld>
        <Feld id="F8" zeile="1" spalte="3" verwendbarkeit="8" punkte="8">R</Feld>
        <Feld id="F9" zeile="1" spalte="4" verwendbarkeit="8" punkte="8">I</Feld>
        <Feld id="F10" zeile="2" spalte="0" verwendbarkeit="9" punkte="9">I</Feld>
        <Feld id="F11" zeile="2" spalte="1" verwendbarkeit="3" punkte="3">O</Feld>
        <Feld id="F12" zeile="2" spalte="2" verwendbarkeit="7" punkte="7">V</Feld>
        <Feld id="F13" zeile="2" spalte="3" verwendbarkeit="3" punkte="3">R</Feld>
        <Feld id="F14" zeile="2" spalte="4" verwendbarkeit="2" punkte="2">P</Feld>
        <Feld id="F15" zeile="3" spalte="0" verwendbarkeit="4" punkte="4">I</Feld>
        <Feld id="F16" zeile="3" spalte="1" verwendbarkeit="2" punkte="2">T</Feld>
        <Feld id="F17" zeile="3" spalte="2" verwendbarkeit="2" punkte="2">T</Feld>
        <Feld id="F18" zeile="3" spalte="3" verwendbarkeit="6" punkte="6">R</Feld>
        <Feld id="F19" zeile="3" spalte="4" verwendbarkeit="9" punkte="9">P</Feld>
        <Feld id="F20" zeile="4" spalte="0" verwendbarkeit="6" punkte="6">N</Feld>
        <Feld id="F21" zeile="4" spalte="1" verwendbarkeit="2" punkte="2">A</Feld>
        <Feld id="F22" zeile="4" spalte="2" verwendbarkeit="0" punkte="0">E</Feld>
        <Feld id="F23" zeile="4" spalte="3" verwendbarkeit="9" punkte="9">I</Feld>
        <Feld id="F24" zeile="4" spalte="4" verwendbarkeit="4" punkte="4">I</Feld>
    </Dschungel>
    <Schlangenarten>
        <Schlangenart id="A0" punkte="100" anzahl="1">
            <Zeichenkette>NATTER</Zeichenkette>
            <Nachbarschaftsstruktur typ="Distanz">
                <Parameter wert="1" />
            </Nachbarschaftsstruktur>
        </Schlangenart>
        <Schlangenart id="A1" punkte="10" anzahl="1">
            <Zeichenkette>OTTER</Zeichenkette>
            <Nachbarschaftsstruktur typ="Distanz">
                <Parameter wert="1" />
            </Nachbarschaftsstruktur>
        </Schlangenart>
        <Schlangenart id="A2" punkte="1" anzahl="1">
            <Zeichenkette>VIPER</Zeichenkette>
            <Nachbarschaftsstruktur typ="Distanz">
                <Parameter wert="1" />
            </Nachbarschaftsstruktur>
        </Schlangenart>
    </Schlangenarten>
    <Schlangen />
</Schlangenjagd>
