<?xml version="1.0" encoding="UTF-8"?>
<!DOCTYPE Schlangenjagd SYSTEM "schlangenjagd.dtd">
<Schlangenjagd>
    <Zeit einheit="d">
        <Vorgabe>2.0E-4</Vorgabe>
    </Zeit>
    <Dschungel zeilen="6" spalten="6" zeichen="BELN">
        <Feld id="F0" zeile="0" spalte="0" verwendbarkeit="1" punkte="5">L</Feld>
        <Feld id="F1" zeile="0" spalte="1" verwendbarkeit="1" punkte="8">N</Feld>
        <Feld id="F2" zeile="0" spalte="2" verwendbarkeit="1" punkte="7">B</Feld>
        <Feld id="F3" zeile="0" spalte="3" verwendbarkeit="1" punkte="3">E</Feld>
        <Feld id="F4" zeile="0" spalte="4" verwendbarkeit="1" punkte="4">E</Feld>
        <Feld id="F5" zeile="0" spalte="5" verwendbarkeit="1" punkte="4">L</Feld>
        <Feld id="F6" zeile="1" spalte="0" verwendbarkeit="1" punkte="4">E</Feld>
        <Feld id="F7" zeile="1" spalte="1" verwendbarkeit="1" punkte="6">E</Feld>
        <Feld id="F8" zeile="1" spalte="2" verwendbarkeit="1" punkte="8">B</Feld>
        <Feld id="F9" zeile="1" spalte="3" verwendbarkeit="1" punkte="8">B</Feld>
        <Feld id="F10" zeile="1" spalte="4" verwendbarkeit="1" punkte="9">B</Feld>
        <Feld id="F11" zeile="1" spalte="5" verwendbarkeit="1" punkte="3">E</Feld>
        <Feld id="F12" zeile="2" spalte="0" verwendbarkeit="1" punkte="7">L</Feld>
        <Feld id="F13" zeile="2" spalte="1" verwendbarkeit="1" punkte="3">L</Feld>
        <Feld id="F14" zeile="2" spalte="2" verwendbarkeit="1" punkte="2">N</Feld>
        <Feld id="F15" zeile="2" spalte="3" verwendbarkeit="1" punkte="4">E</Feld>
        <Feld id="F16" zeile="2" spalte="4" verwendbarkeit="1" punkte="2">N</Feld>
        <Feld id="F17" zeile="2" spalte="5" verwendbarkeit="1" punkte="2">L</Feld>
        <Feld id="F18" zeile="3" spalte="0" verwendbarkeit="1" punkte="6">B</Feld>
        <Feld id="F19" zeile="3" spalte="1" verwendbarkeit="1" punkte="9">E</Feld>
        <Feld id="F20" zeile="3" spalte="2" verwendbarkeit="1" punkte="6">E</Feld>
        <Feld id="F21" zeile="3" spalte="3" verwendbarkeit="1" punkte="2">B</Feld>
        <Feld id="F22" zeile="3" spalte="4" verwendbarkeit="1" punkte="0">L</Feld>
        <Feld id="F23" zeile="3" spalte="5" verwendbarkeit="1" punkte="9">B</Feld>
        <Feld id="F24" zeile="4" spalte="0" verwendbarkeit="1" punkte="4">B</Feld>
        <Feld id="F25" zeile="4" spalte="1" verwendbarkeit="1" punkte="9">N</Feld>
        <Feld id="F26" zeile="4" spalte="2" verwendbarkeit="1" punkte="8">N</Feld>
        <Feld id="F27" zeile="4" spalte="3" verwendbarkeit="1" punkte="3">E</Feld>
        <Feld id="F28" zeile="4" spalte="4" verwendbarkeit="1" punkte="7">E</Feld>
        <Feld id="F29" zeile="4" spalte="5" verwendbarkeit="1" punkte="2">B</Feld>
        <Feld id="F30" zeile="5" spalte="0" verwendbarkeit="1" punkte="5">N</Feld>
        <Feld id="F31" zeile="5" spalte="1" verwendbarkeit="1" punkte="4">L</Feld>
        <Feld id="F32" zeile="5" spalte="2" verwendbarkeit="1" punkte="0">L</Feld>
        <Feld id="F33" zeile="5" spalte="3" verwendbarkeit="1" punkte="6">B</Feld>
        <Feld id="F34" zeile="5" spalte="4" verwendbarkeit="1" punkte="3">N</Feld>
        <Feld id="F35" zeile="5" spalte="5" verwendbarkeit="1" punkte="5">E</Feld>
    </Dschungel>
    <Schlangenarten>
        <Schlangenart id="A0" punkte="20" anzahl="2">
            <Zeichenkette>LEBEN</Zeichenkette>
            <Nachbarschaftsstruktur typ="Distanz">
                <Parameter wert="2" />
            </Nachbarschaftsstruktur>
        </Schlangenart>
        <Schlangenart id="A1" punkte="1" anzahl="2">
            <Zeichenkette>NEBEL</Zeichenkette>
            <Nachbarschaftsstruktur typ="Distanz">
                <Parameter wert="3" />
            </Nachbarschaftsstruktur>
        </Schlangenart>
    </Schlangenarten>
    <Schlangen />
</Schlangenjagd>
