<?xml version="1.0" encoding="UTF-8"?>
<!DOCTYPE Schlangenjagd SYSTEM "schlangenjagd.dtd">
<Schlangenjagd>
    <Zeit einheit="s">
        <Vorgabe>10.0</Vorgabe>
        <Abgabe>10.000001284000001</Abgabe>
    </Zeit>
    <Dschungel zeilen="5" spalten="10" zeichen="ABCDEFGHIJKLMNOPQRSTUVWXYZ">
        <Feld id="F0" zeile="0" spalte="0" verwendbarkeit="1" punkte="1">I</Feld>
        <Feld id="F1" zeile="0" spalte="1" verwendbarkeit="1" punkte="1">D</Feld>
        <Feld id="F2" zeile="0" spalte="2" verwendbarkeit="1" punkte="1">R</Feld>
        <Feld id="F3" zeile="0" spalte="3" verwendbarkeit="1" punkte="1">A</Feld>
        <Feld id="F4" zeile="0" spalte="4" verwendbarkeit="1" punkte="1">S</Feld>
        <Feld id="F5" zeile="0" spalte="5" verwendbarkeit="1" punkte="1">S</Feld>
        <Feld id="F6" zeile="0" spalte="6" verwendbarkeit="1" punkte="1">H</Feld>
        <Feld id="F7" zeile="0" spalte="7" verwendbarkeit="1" punkte="1">I</Feld>
        <Feld id="F8" zeile="0" spalte="8" verwendbarkeit="1" punkte="1">D</Feld>
        <Feld id="F9" zeile="0" spalte="9" verwendbarkeit="1" punkte="1">J</Feld>
        <Feld id="F10" zeile="1" spalte="0" verwendbarkeit="1" punkte="1">E</Feld>
        <Feld id="F11" zeile="1" spalte="1" verwendbarkeit="1" punkte="1">D</Feld>
        <Feld id="F12" zeile="1" spalte="2" verwendbarkeit="1" punkte="1">M</Feld>
        <Feld id="F13" zeile="1" spalte="3" verwendbarkeit="1" punkte="1">E</Feld>
        <Feld id="F14" zeile="1" spalte="4" verwendbarkeit="1" punkte="1">E</Feld>
        <Feld id="F15" zeile="1" spalte="5" verwendbarkeit="1" punkte="1">Y</Feld>
        <Feld id="F16" zeile="1" spalte="6" verwendbarkeit="1" punkte="1">E</Feld>
        <Feld id="F17" zeile="1" spalte="7" verwendbarkeit="1" punkte="1">I</Feld>
        <Feld id="F18" zeile="1" spalte="8" verwendbarkeit="1" punkte="1">U</Feld>
        <Feld id="F19" zeile="1" spalte="9" verwendbarkeit="1" punkte="1">W</Feld>
        <Feld id="F20" zeile="2" spalte="0" verwendbarkeit="1" punkte="1">S</Feld>
        <Feld id="F21" zeile="2" spalte="1" verwendbarkeit="1" punkte="1">E</Feld>
        <Feld id="F22" zeile="2" spalte="2" verwendbarkeit="1" punkte="1">I</Feld>
        <Feld id="F23" zeile="2" spalte="3" verwendbarkeit="1" punkte="1">S</Feld>
        <Feld id="F24" zeile="2" spalte="4" verwendbarkeit="1" punkte="1">W</Feld>
        <Feld id="F25" zeile="2" spalte="5" verwendbarkeit="1" punkte="1">K</Feld>
        <Feld id="F26" zeile="2" spalte="6" verwendbarkeit="1" punkte="1">E</Feld>
        <Feld id="F27" zeile="2" spalte="7" verwendbarkeit="1" punkte="1">D</Feld>
        <Feld id="F28" zeile="2" spalte="8" verwendbarkeit="1" punkte="1">R</Feld>
        <Feld id="F29" zeile="2" spalte="9" verwendbarkeit="1" punkte="1">X</Feld>
        <Feld id="F30" zeile="3" spalte="0" verwendbarkeit="1" punkte="1">E</Feld>
        <Feld id="F31" zeile="3" spalte="1" verwendbarkeit="1" punkte="1">I</Feld>
        <Feld id="F32" zeile="3" spalte="2" verwendbarkeit="1" punkte="1">I</Feld>
        <Feld id="F33" zeile="3" spalte="3" verwendbarkeit="1" punkte="1">N</Feld>
        <Feld id="F34" zeile="3" spalte="4" verwendbarkeit="1" punkte="1">N</Feld>
        <Feld id="F35" zeile="3" spalte="5" verwendbarkeit="1" punkte="1">F</Feld>
        <Feld id="F36" zeile="3" spalte="6" verwendbarkeit="1" punkte="1">E</Feld>
        <Feld id="F37" zeile="3" spalte="7" verwendbarkeit="1" punkte="1">S</Feld>
        <Feld id="F38" zeile="3" spalte="8" verwendbarkeit="1" punkte="1">M</Feld>
        <Feld id="F39" zeile="3" spalte="9" verwendbarkeit="1" punkte="1">Q</Feld>
        <Feld id="F40" zeile="4" spalte="0" verwendbarkeit="1" punkte="1">G</Feld>
        <Feld id="F41" zeile="4" spalte="1" verwendbarkeit="1" punkte="1">D</Feld>
        <Feld id="F42" zeile="4" spalte="2" verwendbarkeit="1" punkte="1">D</Feld>
        <Feld id="F43" zeile="4" spalte="3" verwendbarkeit="1" punkte="1">E</Feld>
        <Feld id="F44" zeile="4" spalte="4" verwendbarkeit="1" punkte="1">S</Feld>
        <Feld id="F45" zeile="4" spalte="5" verwendbarkeit="1" punkte="1">E</Feld>
        <Feld id="F46" zeile="4" spalte="6" verwendbarkeit="1" punkte="1">R</Feld>
        <Feld id="F47" zeile="4" spalte="7" verwendbarkeit="1" punkte="1">E</Feld>
        <Feld id="F48" zeile="4" spalte="8" verwendbarkeit="1" punkte="1">E</Feld>
        <Feld id="F49" zeile="4" spalte="9" verwendbarkeit="1" punkte="1">B</Feld>
    </Dschungel>
    <Schlangenarten>
        <Schlangenart id="A0" punkte="1" anzahl="1">
            <Zeichenkette>DIE</Zeichenkette>
            <Nachbarschaftsstruktur typ="Distanz">
                <Parameter wert="1" />
            </Nachbarschaftsstruktur>
        </Schlangenart>
        <Schlangenart id="A1" punkte="1" anzahl="1">
            <Zeichenkette>DIES</Zeichenkette>
            <Nachbarschaftsstruktur typ="Distanz">
                <Parameter wert="1" />
            </Nachbarschaftsstruktur>
        </Schlangenart>
        <Schlangenart id="A2" punkte="1" anzahl="1">
            <Zeichenkette>DIESE</Zeichenkette>
            <Nachbarschaftsstruktur typ="Distanz">
                <Parameter wert="1" />
            </Nachbarschaftsstruktur>
        </Schlangenart>
        <Schlangenart id="A3" punkte="1" anzahl="1">
            <Zeichenkette>DIESES</Zeichenkette>
            <Nachbarschaftsstruktur typ="Distanz">
                <Parameter wert="1" />
            </Nachbarschaftsstruktur>
        </Schlangenart>
        <Schlangenart id="A4" punkte="1" anzahl="1">
            <Zeichenkette>DIESEN</Zeichenkette>
            <Nachbarschaftsstruktur typ="Distanz">
                <Parameter wert="1" />
            </Nachbarschaftsstruktur>
        </Schlangenart>
        <Schlangenart id="A5" punkte="1" anzahl="1">
            <Zeichenkette>DIESER</Zeichenkette>
            <Nachbarschaftsstruktur typ="Distanz">
                <Parameter wert="1" />
            </Nachbarschaftsstruktur>
        </Schlangenart>
    </Schlangenarten>
    <Schlangen>
        <Schlange art="A0">
            <Schlangenglied feld="F1" />
            <Schlangenglied feld="F0" />
            <Schlangenglied feld="F10" />
        </Schlange>
        <Schlange art="A1">
            <Schlangenglied feld="F8" />
            <Schlangenglied feld="F7" />
            <Schlangenglied feld="F16" />
            <Schlangenglied feld="F5" />
        </Schlange>
        <Schlange art="A2">
            <Schlangenglied feld="F41" />
            <Schlangenglied feld="F31" />
            <Schlangenglied feld="F21" />
            <Schlangenglied feld="F20" />
            <Schlangenglied feld="F30" />
        </Schlange>
        <Schlange art="A3">
            <Schlangenglied feld="F11" />
            <Schlangenglied feld="F22" />
            <Schlangenglied feld="F13" />
            <Schlangenglied feld="F4" />
            <Schlangenglied feld="F14" />
            <Schlangenglied feld="F23" />
        </Schlange>
        <Schlange art="A4">
            <Schlangenglied feld="F42" />
            <Schlangenglied feld="F32" />
            <Schlangenglied feld="F43" />
            <Schlangenglied feld="F44" />
            <Schlangenglied feld="F45" />
            <Schlangenglied feld="F34" />
        </Schlange>
        <Schlange art="A5">
            <Schlangenglied feld="F27" />
            <Schlangenglied feld="F17" />
            <Schlangenglied feld="F26" />
            <Schlangenglied feld="F37" />
            <Schlangenglied feld="F36" />
            <Schlangenglied feld="F46" />
        </Schlange>
    </Schlangen>
</Schlangenjagd>
