<?xml version="1.0" encoding="UTF-8"?>
<!DOCTYPE Schlangenjagd SYSTEM "schlangenjagd.dtd" >
<Schlangenjagd>
	<Zeit einheit="s">
		<Vorgabe>10.0</Vorgabe>
	</Zeit>
	<Dschungel zeilen="7" spalten="7" zeichen="AEIOU">
	</Dschungel>
    <Schlangenarten>
        <Schlangenart id="A0" punkte="10" anzahl="1">
            <Zeichenkette>ADA</Zeichenkette>
            <Nachbarschaftsstruktur typ="Distanz">
                <Parameter wert="1" />
            </Nachbarschaftsstruktur>
        </Schlangenart>
        <Schlangenart id="A1" punkte="10" anzahl="1">
            <Zeichenkette>AMY</Zeichenkette>
            <Nachbarschaftsstruktur typ="Distanz">
                <Parameter wert="1" />
            </Nachbarschaftsstruktur>
        </Schlangenart>
        <Schlangenart id="A2" punkte="10" anzahl="1">
            <Zeichenkette>ANN</Zeichenkette>
            <Nachbarschaftsstruktur typ="Distanz">
                <Parameter wert="1" />
            </Nachbarschaftsstruktur>
        </Schlangenart>
        <Schlangenart id="A3" punkte="10" anzahl="1">
            <Zeichenkette>AVA</Zeichenkette>
            <Nachbarschaftsstruktur typ="Distanz">
                <Parameter wert="1" />
            </Nachbarschaftsstruktur>
        </Schlangenart>
        <Schlangenart id="A4" punkte="10" anzahl="1">
            <Zeichenkette>BEA</Zeichenkette>
            <Nachbarschaftsstruktur typ="Distanz">
                <Parameter wert="1" />
            </Nachbarschaftsstruktur>
        </Schlangenart>
        <Schlangenart id="A5" punkte="10" anzahl="1">
            <Zeichenkette>ELA</Zeichenkette>
            <Nachbarschaftsstruktur typ="Distanz">
                <Parameter wert="1" />
            </Nachbarschaftsstruktur>
        </Schlangenart>
        <Schlangenart id="A6" punkte="10" anzahl="1">
            <Zeichenkette>EVA</Zeichenkette>
            <Nachbarschaftsstruktur typ="Distanz">
                <Parameter wert="1" />
            </Nachbarschaftsstruktur>
        </Schlangenart>
        <Schlangenart id="A7" punkte="10" anzahl="1">
            <Zeichenkette>IDA</Zeichenkette>
            <Nachbarschaftsstruktur typ="Distanz">
                <Parameter wert="1" />
            </Nachbarschaftsstruktur>
        </Schlangenart>
        <Schlangenart id="A8" punkte="10" anzahl="1">
            <Zeichenkette>INA</Zeichenkette>
            <Nachbarschaftsstruktur typ="Distanz">
                <Parameter wert="1" />
            </Nachbarschaftsstruktur>
        </Schlangenart>
        <Schlangenart id="A9" punkte="10" anzahl="1">
            <Zeichenkette>ISA</Zeichenkette>
            <Nachbarschaftsstruktur typ="Distanz">
                <Parameter wert="1" />
            </Nachbarschaftsstruktur>
        </Schlangenart>
        <Schlangenart id="A10" punkte="10" anzahl="1">
            <Zeichenkette>LEA</Zeichenkette>
            <Nachbarschaftsstruktur typ="Distanz">
                <Parameter wert="1" />
            </Nachbarschaftsstruktur>
        </Schlangenart>
        <Schlangenart id="A11" punkte="10" anzahl="1">
            <Zeichenkette>LIA</Zeichenkette>
            <Nachbarschaftsstruktur typ="Distanz">
                <Parameter wert="1" />
            </Nachbarschaftsstruktur>
        </Schlangenart>
        <Schlangenart id="A12" punkte="10" anzahl="1">
            <Zeichenkette>LIN</Zeichenkette>
            <Nachbarschaftsstruktur typ="Distanz">
                <Parameter wert="1" />
            </Nachbarschaftsstruktur>
        </Schlangenart>
        <Schlangenart id="A13" punkte="10" anzahl="1">
            <Zeichenkette>LIV</Zeichenkette>
            <Nachbarschaftsstruktur typ="Distanz">
                <Parameter wert="1" />
            </Nachbarschaftsstruktur>
        </Schlangenart>
        <Schlangenart id="A14" punkte="10" anzahl="1">
            <Zeichenkette>MIA</Zeichenkette>
            <Nachbarschaftsstruktur typ="Distanz">
                <Parameter wert="1" />
            </Nachbarschaftsstruktur>
        </Schlangenart>
        <Schlangenart id="A15" punkte="10" anzahl="1">
            <Zeichenkette>PIA</Zeichenkette>
            <Nachbarschaftsstruktur typ="Distanz">
                <Parameter wert="1" />
            </Nachbarschaftsstruktur>
        </Schlangenart>
        <Schlangenart id="A16" punkte="10" anzahl="1">
            <Zeichenkette>RIA</Zeichenkette>
            <Nachbarschaftsstruktur typ="Distanz">
                <Parameter wert="1" />
            </Nachbarschaftsstruktur>
        </Schlangenart>
        <Schlangenart id="A17" punkte="10" anzahl="1">
            <Zeichenkette>SUE</Zeichenkette>
            <Nachbarschaftsstruktur typ="Distanz">
                <Parameter wert="1" />
            </Nachbarschaftsstruktur>
        </Schlangenart>
        <Schlangenart id="A18" punkte="10" anzahl="1">
            <Zeichenkette>UTE</Zeichenkette>
            <Nachbarschaftsstruktur typ="Distanz">
                <Parameter wert="1" />
            </Nachbarschaftsstruktur>
        </Schlangenart>
        <Schlangenart id="A19" punkte="10" anzahl="1">
            <Zeichenkette>ZOE</Zeichenkette>
            <Nachbarschaftsstruktur typ="Distanz">
                <Parameter wert="1" />
            </Nachbarschaftsstruktur>
        </Schlangenart>
    </Schlangenarten>
</Schlangenjagd>
