<?xml version="1.0" encoding="UTF-8"?>
<!DOCTYPE Schlangenjagd SYSTEM "schlangenjagd.dtd">
<Schlangenjagd>
  <Zeit einheit="s">
    <Vorgabe>1.0</Vorgabe>
    <Abgabe>2.0</Abgabe>
  </Zeit>
  <Dschungel zeilen="2" spalten="3" zeichen="asdertg" />
  <Schlangenarten>
    <Schlangenart id="A0" punkte="1" anzahl="1">
      <Zeichenkette>abcdefghij</Zeichenkette>
      <Nachbarschaftsstruktur typ="Distanz">
        <Parameter wert="2" />
      </Nachbarschaftsstruktur>
    </Schlangenart>
    <Schlangenart id="A1" punkte="21" anzahl="31">
      <Zeichenkette>hjgzhi</Zeichenkette>
      <Nachbarschaftsstruktur typ="Distanz">
        <Parameter wert="2" />
      </Nachbarschaftsstruktur>
    </Schlangenart>
  </Schlangenarten>
</Schlangenjagd>
