<?xml version="1.0" encoding="UTF-8"?>
<!DOCTYPE Schlangenjagd SYSTEM "schlangenjagd.dtd">
<Schlangenjagd>
  <Zeit einheit="s">
    <Vorgabe>10.0</Vorgabe>
    <Abgabe>10.000012218</Abgabe>
  </Zeit>
  <Dschungel zeilen="10" spalten="5" zeichen="!&quot;§$%&amp;/()=?+*~#',;:-_@€&lt;&gt;|">
    <Feld id="F0" zeile="0" spalte="0" verwendbarkeit="1" punkte="5">N</Feld>
    <Feld id="F1" zeile="0" spalte="1" verwendbarkeit="1" punkte="8">a</Feld>
    <Feld id="F2" zeile="0" spalte="2" verwendbarkeit="1" punkte="7">e</Feld>
    <Feld id="F3" zeile="0" spalte="3" verwendbarkeit="1" punkte="3">h</Feld>
    <Feld id="F4" zeile="0" spalte="4" verwendbarkeit="1" punkte="4">;</Feld>
    <Feld id="F5" zeile="1" spalte="0" verwendbarkeit="1" punkte="4">N</Feld>
    <Feld id="F6" zeile="1" spalte="1" verwendbarkeit="1" punkte="4">H</Feld>
    <Feld id="F7" zeile="1" spalte="2" verwendbarkeit="1" punkte="6">G</Feld>
    <Feld id="F8" zeile="1" spalte="3" verwendbarkeit="1" punkte="8">g</Feld>
    <Feld id="F9" zeile="1" spalte="4" verwendbarkeit="1" punkte="8">E</Feld>
    <Feld id="F10" zeile="2" spalte="0" verwendbarkeit="1" punkte="9">E</Feld>
    <Feld id="F11" zeile="2" spalte="1" verwendbarkeit="1" punkte="3">A</Feld>
    <Feld id="F12" zeile="2" spalte="2" verwendbarkeit="1" punkte="7">N</Feld>
    <Feld id="F13" zeile="2" spalte="3" verwendbarkeit="1" punkte="3">G</Feld>
    <Feld id="F14" zeile="2" spalte="4" verwendbarkeit="1" punkte="2">e</Feld>
    <Feld id="F15" zeile="3" spalte="0" verwendbarkeit="1" punkte="4">N</Feld>
    <Feld id="F16" zeile="3" spalte="1" verwendbarkeit="1" punkte="2">n</Feld>
    <Feld id="F17" zeile="3" spalte="2" verwendbarkeit="1" punkte="2">A</Feld>
    <Feld id="F18" zeile="3" spalte="3" verwendbarkeit="1" punkte="6">A</Feld>
    <Feld id="F19" zeile="3" spalte="4" verwendbarkeit="1" punkte="9">h</Feld>
    <Feld id="F20" zeile="4" spalte="0" verwendbarkeit="1" punkte="6">G</Feld>
    <Feld id="F21" zeile="4" spalte="1" verwendbarkeit="1" punkte="2">e</Feld>
    <Feld id="F22" zeile="4" spalte="2" verwendbarkeit="1" punkte="0">e</Feld>
    <Feld id="F23" zeile="4" spalte="3" verwendbarkeit="1" punkte="9">G</Feld>
    <Feld id="F24" zeile="4" spalte="4" verwendbarkeit="1" punkte="4">!</Feld>
    <Feld id="F25" zeile="5" spalte="0" verwendbarkeit="1" punkte="9">N</Feld>
    <Feld id="F26" zeile="5" spalte="1" verwendbarkeit="1" punkte="8">G</Feld>
    <Feld id="F27" zeile="5" spalte="2" verwendbarkeit="1" punkte="3">g</Feld>
    <Feld id="F28" zeile="5" spalte="3" verwendbarkeit="1" punkte="7">H</Feld>
    <Feld id="F29" zeile="5" spalte="4" verwendbarkeit="1" punkte="2">H</Feld>
    <Feld id="F30" zeile="6" spalte="0" verwendbarkeit="1" punkte="5">(</Feld>
    <Feld id="F31" zeile="6" spalte="1" verwendbarkeit="1" punkte="4">e</Feld>
    <Feld id="F32" zeile="6" spalte="2" verwendbarkeit="1" punkte="0">=</Feld>
    <Feld id="F33" zeile="6" spalte="3" verwendbarkeit="1" punkte="6">n</Feld>
    <Feld id="F34" zeile="6" spalte="4" verwendbarkeit="1" punkte="3">e</Feld>
    <Feld id="F35" zeile="7" spalte="0" verwendbarkeit="1" punkte="5">a</Feld>
    <Feld id="F36" zeile="7" spalte="1" verwendbarkeit="1" punkte="9">h</Feld>
    <Feld id="F37" zeile="7" spalte="2" verwendbarkeit="1" punkte="0">N</Feld>
    <Feld id="F38" zeile="7" spalte="3" verwendbarkeit="1" punkte="5">*</Feld>
    <Feld id="F39" zeile="7" spalte="4" verwendbarkeit="1" punkte="4">a</Feld>
    <Feld id="F40" zeile="8" spalte="0" verwendbarkeit="1" punkte="5">&gt;</Feld>
    <Feld id="F41" zeile="8" spalte="1" verwendbarkeit="1" punkte="0">H</Feld>
    <Feld id="F42" zeile="8" spalte="2" verwendbarkeit="1" punkte="7">G</Feld>
    <Feld id="F43" zeile="8" spalte="3" verwendbarkeit="1" punkte="7">A</Feld>
    <Feld id="F44" zeile="8" spalte="4" verwendbarkeit="1" punkte="7">a</Feld>
    <Feld id="F45" zeile="9" spalte="0" verwendbarkeit="1" punkte="2">_</Feld>
    <Feld id="F46" zeile="9" spalte="1" verwendbarkeit="1" punkte="0">€</Feld>
    <Feld id="F47" zeile="9" spalte="2" verwendbarkeit="1" punkte="8">€</Feld>
    <Feld id="F48" zeile="9" spalte="3" verwendbarkeit="1" punkte="0">?</Feld>
    <Feld id="F49" zeile="9" spalte="4" verwendbarkeit="1" punkte="7">h</Feld>
  </Dschungel>
  <Schlangenarten>
    <Schlangenart id="A0" punkte="1" anzahl="2">
      <Zeichenkette>hagen</Zeichenkette>
      <Nachbarschaftsstruktur typ="Distanz">
        <Parameter wert="3" />
      </Nachbarschaftsstruktur>
    </Schlangenart>
    <Schlangenart id="A1" punkte="1" anzahl="2">
      <Zeichenkette>HAGEN</Zeichenkette>
      <Nachbarschaftsstruktur typ="Distanz">
        <Parameter wert="3" />
      </Nachbarschaftsstruktur>
    </Schlangenart>
    <Schlangenart id="A2" punkte="1" anzahl="2">
      <Zeichenkette>HaGeN</Zeichenkette>
      <Nachbarschaftsstruktur typ="Distanz">
        <Parameter wert="3" />
      </Nachbarschaftsstruktur>
    </Schlangenart>
    <Schlangenart id="A3" punkte="1" anzahl="2">
      <Zeichenkette>hAGeN</Zeichenkette>
      <Nachbarschaftsstruktur typ="Distanz">
        <Parameter wert="3" />
      </Nachbarschaftsstruktur>
    </Schlangenart>
  </Schlangenarten>
  <Schlangen>
    <Schlange art="A1">
      <Schlangenglied feld="F28" />
      <Schlangenglied feld="F43" />
      <Schlangenglied feld="F26" />
      <Schlangenglied feld="F10" />
      <Schlangenglied feld="F25" />
    </Schlange>
    <Schlange art="A0">
      <Schlangenglied feld="F19" />
      <Schlangenglied feld="F1" />
      <Schlangenglied feld="F8" />
      <Schlangenglied feld="F21" />
      <Schlangenglied feld="F33" />
    </Schlange>
    <Schlange art="A3">
      <Schlangenglied feld="F3" />
      <Schlangenglied feld="F18" />
      <Schlangenglied feld="F7" />
      <Schlangenglied feld="F2" />
      <Schlangenglied feld="F0" />
    </Schlange>
    <Schlange art="A1">
      <Schlangenglied feld="F6" />
      <Schlangenglied feld="F11" />
      <Schlangenglied feld="F23" />
      <Schlangenglied feld="F9" />
      <Schlangenglied feld="F12" />
    </Schlange>
    <Schlange art="A0">
      <Schlangenglied feld="F36" />
      <Schlangenglied feld="F44" />
      <Schlangenglied feld="F27" />
      <Schlangenglied feld="F34" />
      <Schlangenglied feld="F16" />
    </Schlange>
    <Schlange art="A2">
      <Schlangenglied feld="F29" />
      <Schlangenglied feld="F39" />
      <Schlangenglied feld="F42" />
      <Schlangenglied feld="F31" />
      <Schlangenglied feld="F15" />
    </Schlange>
    <Schlange art="A2">
      <Schlangenglied feld="F41" />
      <Schlangenglied feld="F35" />
      <Schlangenglied feld="F20" />
      <Schlangenglied feld="F22" />
      <Schlangenglied feld="F5" />
    </Schlange>
  </Schlangen>
</Schlangenjagd>
