<?xml version="1.0" encoding="UTF-8"?>
<!DOCTYPE Schlangenjagd SYSTEM "schlangenjagd.dtd" >
<Schlangenjagd>
	<Zeit einheit="s">
		<Vorgabe>10.0</Vorgabe>
	</Zeit>
	<Dschungel zeilen="15" spalten="20" zeichen=".">
	</Dschungel>
	<Schlangenarten>
		<Schlangenart id="A0" punkte="1" anzahl="1">
			<Zeichenkette>FERNUNI</Zeichenkette>
			<Nachbarschaftsstruktur typ="Stern">
				<Parameter wert="2" />
				<Parameter wert="2" />
			</Nachbarschaftsstruktur>
		</Schlangenart>
		<Schlangenart id="A1" punkte="1" anzahl="1">
			<Zeichenkette>HAGEN</Zeichenkette>
			<Nachbarschaftsstruktur typ="Stern">
				<Parameter wert="3" />
				<Parameter wert="0" />
			</Nachbarschaftsstruktur>
		</Schlangenart>
		<Schlangenart id="A2" punkte="1" anzahl="1">
			<Zeichenkette>PROPRA</Zeichenkette>
			<Nachbarschaftsstruktur typ="Stern">
				<Parameter wert="0" />
				<Parameter wert="4" />
			</Nachbarschaftsstruktur>
		</Schlangenart>
	</Schlangenarten>
</Schlangenjagd>
