<?xml version="1.0" encoding="UTF-8"?>
<!DOCTYPE Schlangenjagd SYSTEM "schlangenjagd.dtd" >
<Schlangenjagd>
	<Zeit einheit="s">
		<Vorgabe>10.0</Vorgabe>
	</Zeit>
	<Dschungel zeilen="20" spalten="20" zeichen="ABCDEFGHIJKLMNOPQRSTUVWXYZ">
	</Dschungel>
	<Schlangenarten>
		<Schlangenart id="A0" punkte="1" anzahl="3">
			<Zeichenkette>FERNUNI</Zeichenkette>
			<Nachbarschaftsstruktur typ="Distanz">
				<Parameter wert="1" />
			</Nachbarschaftsstruktur>
		</Schlangenart>
		<Schlangenart id="A1" punkte="1" anzahl="3">
			<Zeichenkette>HAGEN</Zeichenkette>
			<Nachbarschaftsstruktur typ="Sprung">
				<Parameter wert="2" />
				<Parameter wert="1" />
			</Nachbarschaftsstruktur>
		</Schlangenart>
		<Schlangenart id="A2" punkte="1" anzahl="3">
			<Zeichenkette>ANACONDA</Zeichenkette>
			<Nachbarschaftsstruktur typ="Sprung">
				<Parameter wert="3" />
				<Parameter wert="2" />
			</Nachbarschaftsstruktur>
		</Schlangenart>
	</Schlangenarten>
</Schlangenjagd>
