<?xml version="1.0" encoding="UTF-8"?>
<!DOCTYPE Schlangenjagd SYSTEM "schlangenjagd.dtd" >
<Schlangenjagd>
	<Zeit einheit="s">
		<Vorgabe>10.0</Vorgabe>
	</Zeit>
	<Dschungel zeilen="20" spalten="20" zeichen="'">
	</Dschungel>
    <Schlangenarten>
        <Schlangenart id="A0" punkte="150" anzahl="1">
            <Zeichenkette>01000110010001010101001001001110010101010100111001001001</Zeichenkette>
            <Nachbarschaftsstruktur typ="Distanz">
                <Parameter wert="1" />
            </Nachbarschaftsstruktur>
        </Schlangenart>
        <Schlangenart id="A1" punkte="100" anzahl="1">
            <Zeichenkette>0100100001000001010001110100010101001110</Zeichenkette>
            <Nachbarschaftsstruktur typ="Distanz">
                <Parameter wert="1" />
            </Nachbarschaftsstruktur>
        </Schlangenart>
    </Schlangenarten>
</Schlangenjagd>
